[
  { "id": "brewmasters-day", "name": "Brewmasters Day", "good": true, "arrivals": 1.6, "price": 0.75, "repGain": 1.3 },
  { "id": "beer-day", "name": "Beer Day", "good": true, "arrivals": 1.35, "tips": 0.1 },
  { "id": "providas", "name": "Providas", "good": false, "arrivals": 0.45 },
  { "id": "liquor-day", "name": "Liquor Day", "good": true, "arrivals": 1.3 },
  { "id": "earthen-veil", "name": "Night of the Earthen Veil", "good": true, "arrivals": 0.9, "repGain": 1.2 },
  { "id": "unholy-pilgrimage", "name": "Unholy Pilgrimage", "good": true, "arrivals": 1.5 },
  { "id": "red-tide-festival", "name": "Festival of the Red Tide", "good": true, "arrivals": 1.4, "tips": 0.15 },
  { "id": "beggars-dance", "name": "Beggars Dance", "good": true, "arrivals": 1.3 },
  { "id": "hoppy-holidays", "name": "Hoppy Holidays", "good": true, "arrivals": 2.0, "tips": 0.1 },
  { "id": "prophecy-restless", "name": "Restless Isles", "good": false, "repSwing": 1.7 },
  { "id": "patmos-sweep", "name": "Addy's Sweep", "good": false, "categoryBan": ["grog", "spirits"], "tithe": 0.08 },
  { "id": "friar-favor", "name": "Friars' Favour", "good": true, "tithe": -0.06 },
  { "id": "friar-compliance", "name": "Friar-approved Menu", "good": false, "categoryBan": ["grog"] },
  { "id": "windsunk-grudge", "name": "Windsunk Grudge", "good": false, "brawl": 1.5, "shippingLoss": 0.1 },
  { "id": "taboo-raid", "name": "Taboo Tide", "good": false, "tabooBlocked": true },
  { "id": "cumstead-blight", "name": "Cumstead Blight", "good": false, "grainPrice": 2.2 },
  { "id": "cumstead-contract", "name": "Cumstead Contract", "good": true, "grainPrice": 0.8 },
  { "id": "smallholder-grain", "name": "Smallholder Grain", "good": true, "grainPrice": 1.1, "quality": 3 },
  { "id": "veil-curse", "name": "Veil-cursed", "good": false, "spoilage": 2.5, "brawl": 1.3, "shippingLoss": 0.2 },
  { "id": "veil-blessing", "name": "Veil-blessed", "good": true, "spoilage": 0, "quality": 6 },
  { "id": "vow-bound", "name": "Vow-bound", "good": true, "repGain": 1.1 },
  { "id": "cartel", "name": "Price Truce", "good": true, "price": 1.12, "arrivals": 0.97 },
  { "id": "showmen", "name": "Rum Ridge Showmen", "good": true, "arrivals": 1.45, "repGain": 1.3 },
  { "id": "bad-press", "name": "Bad Press", "good": false, "repGain": 0.6, "arrivals": 0.88 },
  { "id": "stormtide-wreckers", "name": "Wreckers About", "good": false, "shippingLoss": 0.35 },
  { "id": "escorts", "name": "Hired Escorts", "good": true, "shippingLoss": -0.3 },
  { "id": "grog-pulled", "name": "Grog Pulled", "good": false, "categoryBan": ["grog"] },
  { "id": "shorelan-raid", "name": "Shorelan Watch", "good": false, "categoryBan": ["tonic"] },
  { "id": "promo-night", "name": "Promo Night", "good": true, "arrivals": 1.3, "price": 0.92 },
  { "id": "price-war", "name": "Price War", "good": false, "price": 0.85, "arrivals": 1.1 },
  { "id": "rival-promo", "name": "Rival Promotion", "good": false, "arrivals": 0.85 },
  { "id": "thugs", "name": "Hired Thugs", "good": false, "brawl": 1.9 },
  { "id": "spoiled-kegs", "name": "Tampered Kegs", "good": false, "spoilage": 3 },
  { "id": "price-up", "name": "Raised Prices", "good": true, "price": 1.1, "arrivals": 0.93 },
  { "id": "bulk-buy", "name": "Bulk Kegs", "good": true, "kegCost": 0.85 },
  { "id": "shutdown", "name": "Doors Shut", "good": false, "arrivals": 0 },
  { "id": "trials-fever", "name": "Trials Fever", "good": true, "arrivals": 1.15, "repGain": 1.2 }
]
